{"generado":"2026-10-17T17:28:35Z","destino":{"destino_id":"cuetzalan","nombre":"Cuetzalan","tipo":"pueblo_magico","zona":"Sierra Nororiental","municipios":["21043"]},"periodo_ref":{"desde":"2025-07","hasta":"2026-06"},"desempeno":{"ocupacion_12m":42.7,"cuartos_libres_dia_12m":418.0,"llegadas_12m":203564,"crecimiento_llegadas_pct":8.5,"estadia_promedio_dias":1.84,"derrama_por_visitante_mxn":846.0,"mediana_pm_ocupacion_12m":44.1},"serie_mensual":[{"periodo":"2023-07","llegadas_turistas":17030.0,"ocupacion_pct":42.5},{"periodo":"2023-08","llegadas_turistas":20167.0,"ocupacion_pct":50.6},{"periodo":"2023-09","llegadas_turistas":12952.0,"ocupacion_pct":32.6},{"periodo":"2023-10","llegadas_turistas":16913.0,"ocupacion_pct":42.3},{"periodo":"2023-11","llegadas_turistas":16096.0,"ocupacion_pct":41.0},{"periodo":"2023-12","llegadas_turistas":17006.0,"ocupacion_pct":42.5},{"periodo":"2024-01","llegadas_turistas":12664.0,"ocupacion_pct":32.4},{"periodo":"2024-02","llegadas_turistas":11382.0,"ocupacion_pct":30.5},{"periodo":"2024-03","llegadas_turistas":17763.0,"ocupacion_pct":44.2},{"periodo":"2024-04","llegadas_turistas":17590.0,"ocupacion_pct":45.1},{"periodo":"2024-05","llegadas_turistas":15061.0,"ocupacion_pct":37.8},{"periodo":"2024-06","llegadas_turistas":14689.0,"ocupacion_pct":38.0},{"periodo":"2024-07","llegadas_turistas":16178.0,"ocupacion_pct":40.6},{"periodo":"2024-08","llegadas_turistas":16469.0,"ocupacion_pct":41.4},{"periodo":"2024-09","llegadas_turistas":14770.0,"ocupacion_pct":38.6},{"periodo":"2024-10","llegadas_turistas":15378.0,"ocupacion_pct":38.9},{"periodo":"2024-11","llegadas_turistas":15487.0,"ocupacion_pct":40.1},{"periodo":"2024-12","llegadas_turistas":17030.0,"ocupacion_pct":42.6},{"periodo":"2025-01","llegadas_turistas":14418.0,"ocupacion_pct":36.1},{"periodo":"2025-02","llegadas_turistas":13128.0,"ocupacion_pct":36.4},{"periodo":"2025-03","llegadas_turistas":15213.0,"ocupacion_pct":37.9},{"periodo":"2025-04","llegadas_turistas":17388.0,"ocupacion_pct":44.9},{"periodo":"2025-05","llegadas_turistas":17038.0,"ocupacion_pct":41.9},{"periodo":"2025-06","llegadas_turistas":15112.0,"ocupacion_pct":38.8},{"periodo":"2025-07","llegadas_turistas":17645.0,"ocupacion_pct":43.4},{"periodo":"2025-08","llegadas_turistas":17213.0,"ocupacion_pct":42.4},{"periodo":"2025-09","llegadas_turistas":15110.0,"ocupacion_pct":38.8},{"periodo":"2025-10","llegadas_turistas":16262.0,"ocupacion_pct":40.0},{"periodo":"2025-11","llegadas_turistas":16053.0,"ocupacion_pct":41.1},{"periodo":"2025-12","llegadas_turistas":21434.0,"ocupacion_pct":53.0},{"periodo":"2026-01","llegadas_turistas":14436.0,"ocupacion_pct":36.1},{"periodo":"2026-02","llegadas_turistas":13188.0,"ocupacion_pct":36.6},{"periodo":"2026-03","llegadas_turistas":16123.0,"ocupacion_pct":39.9},{"periodo":"2026-04","llegadas_turistas":18156.0,"ocupacion_pct":46.1},{"periodo":"2026-05","llegadas_turistas":18873.0,"ocupacion_pct":46.1},{"periodo":"2026-06","llegadas_turistas":19071.0,"ocupacion_pct":48.7}],"radar":{"indice_atencion":71.2,"indice_desempeno":27.3,"brecha":43.9,"cuadrante":"atencion_sin_estancia","recomendacion":"Convertir la atención en pernocta: motivos para quedarse y resolver fricciones","sensible":false,"componentes":{"busqueda":{"valor":16.17,"pctl":63.6,"n":12},"video":{"valor":3.36,"pctl":77.3,"n":149},"asistentes":{"valor":56.59,"pctl":72.7,"n":440}}},"asistentes":{"por_idioma":[{"idioma":"es","n":180,"k":117,"pct":65.0,"ic95_bajo":57.8,"ic95_alto":71.6},{"idioma":"en","n":80,"k":26,"pct":32.5,"ic95_bajo":23.2,"ic95_alto":43.4},{"idioma":"fr","n":60,"k":39,"pct":65.0,"ic95_bajo":52.4,"ic95_alto":75.8},{"idioma":"ko","n":60,"k":29,"pct":48.3,"ic95_bajo":36.2,"ic95_alto":60.7},{"idioma":"zh","n":60,"k":38,"pct":63.3,"ic95_bajo":50.7,"ic95_alto":74.4}],"dominios":[{"dominio":"visitpuebla.mx","tipo_dominio":"gobierno","n_citas":86},{"dominio":"sectur.gob.mx","tipo_dominio":"gobierno","n_citas":74},{"dominio":"gob.mx","tipo_dominio":"gobierno","n_citas":58},{"dominio":"eluniversalpuebla.com.mx","tipo_dominio":"medio","n_citas":44},{"dominio":"visitmexico.com","tipo_dominio":"gobierno","n_citas":43}]},"redes":null,"opinion":null,"escenario":null,"fuentes":["sectur-ot-2026-06","inegi-mg-2025-12","asistentes-auditoria","google-trends"],"notas":["Sin dato de panel"]}
