{"generado":"2026-10-16T12:51:05Z","destino":{"destino_id":"cholula","nombre":"Cholula","tipo":"pueblo_magico","zona":"Centro","municipios":["21140","21119"]},"periodo_ref":{"desde":"2025-07","hasta":"2026-06"},"desempeno":{"ocupacion_12m":57.8,"cuartos_libres_dia_12m":626.4,"llegadas_12m":539039,"crecimiento_llegadas_pct":2.7,"estadia_promedio_dias":1.87,"derrama_por_visitante_mxn":1097.0,"mediana_pm_ocupacion_12m":44.1},"serie_mensual":[{"periodo":"2023-07","llegadas_turistas":46188.0,"ocupacion_pct":57.5},{"periodo":"2023-08","llegadas_turistas":52296.0,"ocupacion_pct":64.8},{"periodo":"2023-09","llegadas_turistas":37245.0,"ocupacion_pct":47.8},{"periodo":"2023-10","llegadas_turistas":46436.0,"ocupacion_pct":57.6},{"periodo":"2023-11","llegadas_turistas":45842.0,"ocupacion_pct":58.9},{"periodo":"2023-12","llegadas_turistas":45973.0,"ocupacion_pct":57.0},{"periodo":"2024-01","llegadas_turistas":30329.0,"ocupacion_pct":37.6},{"periodo":"2024-02","llegadas_turistas":28005.0,"ocupacion_pct":36.7},{"periodo":"2024-03","llegadas_turistas":41145.0,"ocupacion_pct":51.1},{"periodo":"2024-04","llegadas_turistas":42247.0,"ocupacion_pct":54.0},{"periodo":"2024-05","llegadas_turistas":39251.0,"ocupacion_pct":51.9},{"periodo":"2024-06","llegadas_turistas":42203.0,"ocupacion_pct":53.6},{"periodo":"2024-07","llegadas_turistas":42915.0,"ocupacion_pct":55.9},{"periodo":"2024-08","llegadas_turistas":45495.0,"ocupacion_pct":56.1},{"periodo":"2024-09","llegadas_turistas":41888.0,"ocupacion_pct":57.2},{"periodo":"2024-10","llegadas_turistas":43616.0,"ocupacion_pct":56.8},{"periodo":"2024-11","llegadas_turistas":42688.0,"ocupacion_pct":58.0},{"periodo":"2024-12","llegadas_turistas":44724.0,"ocupacion_pct":59.4},{"periodo":"2025-01","llegadas_turistas":42218.0,"ocupacion_pct":53.1},{"periodo":"2025-02","llegadas_turistas":38156.0,"ocupacion_pct":52.9},{"periodo":"2025-03","llegadas_turistas":43515.0,"ocupacion_pct":53.5},{"periodo":"2025-04","llegadas_turistas":50296.0,"ocupacion_pct":58.8},{"periodo":"2025-05","llegadas_turistas":45906.0,"ocupacion_pct":57.1},{"periodo":"2025-06","llegadas_turistas":43246.0,"ocupacion_pct":58.2},{"periodo":"2025-07","llegadas_turistas":46232.0,"ocupacion_pct":58.4},{"periodo":"2025-08","llegadas_turistas":47408.0,"ocupacion_pct":60.1},{"periodo":"2025-09","llegadas_turistas":43241.0,"ocupacion_pct":55.4},{"periodo":"2025-10","llegadas_turistas":43991.0,"ocupacion_pct":60.5},{"periodo":"2025-11","llegadas_turistas":45951.0,"ocupacion_pct":60.4},{"periodo":"2025-12","llegadas_turistas":49898.0,"ocupacion_pct":62.5},{"periodo":"2026-01","llegadas_turistas":41674.0,"ocupacion_pct":51.9},{"periodo":"2026-02","llegadas_turistas":38319.0,"ocupacion_pct":53.2},{"periodo":"2026-03","llegadas_turistas":45173.0,"ocupacion_pct":55.3},{"periodo":"2026-04","llegadas_turistas":43336.0,"ocupacion_pct":57.9},{"periodo":"2026-05","llegadas_turistas":47581.0,"ocupacion_pct":59.4},{"periodo":"2026-06","llegadas_turistas":46235.0,"ocupacion_pct":58.8}],"radar":{"indice_atencion":100.0,"indice_desempeno":100.0,"brecha":0.0,"cuadrante":"consolidado","recomendacion":"Mantener; medir la saturación","sensible":false,"componentes":{"busqueda":{"valor":57.5,"pctl":100.0,"n":12},"asistentes":{"valor":78.68,"pctl":100.0,"n":380}}},"asistentes":{"por_idioma":[{"idioma":"es","n":180,"k":107,"pct":59.4,"ic95_bajo":52.1,"ic95_alto":66.3},{"idioma":"en","n":80,"k":72,"pct":90.0,"ic95_bajo":81.5,"ic95_alto":94.8},{"idioma":"fr","n":41,"k":41,"pct":100.0,"ic95_bajo":91.4,"ic95_alto":100.0},{"idioma":"ko","n":39,"k":39,"pct":100.0,"ic95_bajo":91.0,"ic95_alto":100.0},{"idioma":"zh","n":40,"k":40,"pct":100.0,"ic95_bajo":91.2,"ic95_alto":100.0}],"dominios":[{"dominio":"en.wikipedia.org","tipo_dominio":"enciclopedia","n_citas":46},{"dominio":"whc.unesco.org","tipo_dominio":"otro","n_citas":46},{"dominio":"museoamparo.com","tipo_dominio":"otro","n_citas":42},{"dominio":"opentravelguide.com","tipo_dominio":"blog","n_citas":38},{"dominio":"visitpuebla.mx","tipo_dominio":"otro","n_citas":37}]},"redes":null,"opinion":null,"escenario":null,"fuentes":["sectur-ot-2026-06","inegi-mg-2025-12","asistentes-auditoria","google-trends"],"notas":["Sin dato de video, panel","Con solo 2 componentes no se puede medir la sensibilidad"]}
