{"generado":"2026-10-16T09:04:44Z","destino":{"destino_id":"tetela-de-ocampo","nombre":"Tetela de Ocampo","tipo":"pueblo_magico","zona":"Sierra Norte","municipios":["21172"]},"periodo_ref":{"desde":"2025-07","hasta":"2026-06"},"desempeno":{"ocupacion_12m":33.8,"cuartos_libres_dia_12m":105.9,"llegadas_12m":35335,"crecimiento_llegadas_pct":-0.8,"estadia_promedio_dias":1.82,"derrama_por_visitante_mxn":1048.0,"mediana_pm_ocupacion_12m":44.1},"serie_mensual":[{"periodo":"2023-07","llegadas_turistas":3145.0,"ocupacion_pct":33.8},{"periodo":"2023-08","llegadas_turistas":3387.0,"ocupacion_pct":35.8},{"periodo":"2023-09","llegadas_turistas":2775.0,"ocupacion_pct":29.3},{"periodo":"2023-10","llegadas_turistas":2566.0,"ocupacion_pct":26.7},{"periodo":"2023-11","llegadas_turistas":2608.0,"ocupacion_pct":28.4},{"periodo":"2023-12","llegadas_turistas":2904.0,"ocupacion_pct":30.2},{"periodo":"2024-01","llegadas_turistas":2299.0,"ocupacion_pct":24.1},{"periodo":"2024-02","llegadas_turistas":2180.0,"ocupacion_pct":24.6},{"periodo":"2024-03","llegadas_turistas":3448.0,"ocupacion_pct":36.2},{"periodo":"2024-04","llegadas_turistas":2800.0,"ocupacion_pct":29.9},{"periodo":"2024-05","llegadas_turistas":2549.0,"ocupacion_pct":26.9},{"periodo":"2024-06","llegadas_turistas":2871.0,"ocupacion_pct":31.2},{"periodo":"2024-07","llegadas_turistas":3091.0,"ocupacion_pct":32.4},{"periodo":"2024-08","llegadas_turistas":3433.0,"ocupacion_pct":36.2},{"periodo":"2024-09","llegadas_turistas":2973.0,"ocupacion_pct":33.2},{"periodo":"2024-10","llegadas_turistas":3135.0,"ocupacion_pct":33.8},{"periodo":"2024-11","llegadas_turistas":2931.0,"ocupacion_pct":31.8},{"periodo":"2024-12","llegadas_turistas":2904.0,"ocupacion_pct":30.2},{"periodo":"2025-01","llegadas_turistas":2735.0,"ocupacion_pct":28.4},{"periodo":"2025-02","llegadas_turistas":2526.0,"ocupacion_pct":29.5},{"periodo":"2025-03","llegadas_turistas":2950.0,"ocupacion_pct":31.3},{"periodo":"2025-04","llegadas_turistas":3116.0,"ocupacion_pct":34.8},{"periodo":"2025-05","llegadas_turistas":2950.0,"ocupacion_pct":31.3},{"periodo":"2025-06","llegadas_turistas":2887.0,"ocupacion_pct":32.1},{"periodo":"2025-07","llegadas_turistas":3456.0,"ocupacion_pct":34.8},{"periodo":"2025-08","llegadas_turistas":3547.0,"ocupacion_pct":38.4},{"periodo":"2025-09","llegadas_turistas":2954.0,"ocupacion_pct":33.0},{"periodo":"2025-10","llegadas_turistas":1362.0,"ocupacion_pct":29.4},{"periodo":"2025-11","llegadas_turistas":3058.0,"ocupacion_pct":34.5},{"periodo":"2025-12","llegadas_turistas":3246.0,"ocupacion_pct":35.1},{"periodo":"2026-01","llegadas_turistas":2897.0,"ocupacion_pct":31.2},{"periodo":"2026-02","llegadas_turistas":2592.0,"ocupacion_pct":30.1},{"periodo":"2026-03","llegadas_turistas":2990.0,"ocupacion_pct":32.5},{"periodo":"2026-04","llegadas_turistas":2946.0,"ocupacion_pct":33.5},{"periodo":"2026-05","llegadas_turistas":3044.0,"ocupacion_pct":33.5},{"periodo":"2026-06","llegadas_turistas":3243.0,"ocupacion_pct":36.5}],"radar":{"indice_atencion":22.7,"indice_desempeno":9.1,"brecha":13.6,"cuadrante":"por_posicionar","recomendacion":"Prioridad de promoción si la experiencia reportada es buena","sensible":false,"componentes":{"busqueda":{"valor":2.39,"pctl":9.1,"n":12},"asistentes":{"valor":18.16,"pctl":36.4,"n":380}}},"asistentes":{"por_idioma":[{"idioma":"es","n":180,"k":55,"pct":30.6,"ic95_bajo":24.3,"ic95_alto":37.6},{"idioma":"en","n":80,"k":9,"pct":11.2,"ic95_bajo":6.0,"ic95_alto":20.0},{"idioma":"fr","n":41,"k":2,"pct":4.9,"ic95_bajo":1.3,"ic95_alto":16.1},{"idioma":"ko","n":39,"k":1,"pct":2.6,"ic95_bajo":0.5,"ic95_alto":13.2},{"idioma":"zh","n":40,"k":2,"pct":5.0,"ic95_bajo":1.4,"ic95_alto":16.5}],"dominios":[{"dominio":"visitpuebla.mx","tipo_dominio":"otro","n_citas":38},{"dominio":"sectur.gob.mx","tipo_dominio":"gobierno","n_citas":33},{"dominio":"gob.mx","tipo_dominio":"gobierno","n_citas":23},{"dominio":"eluniversalpuebla.com.mx","tipo_dominio":"medio","n_citas":21},{"dominio":"visitmexico.com","tipo_dominio":"gobierno","n_citas":18}]},"redes":null,"opinion":null,"escenario":null,"fuentes":["sectur-ot-2026-06","inegi-mg-2025-12","asistentes-auditoria","google-trends"],"notas":["Sin dato de video, panel","Con solo 2 componentes no se puede medir la sensibilidad"]}
