{"generado":"2026-10-17T17:13:24Z","destino":{"destino_id":"huejotzingo","nombre":"Huejotzingo","tipo":"pueblo_magico","zona":"Centro","municipios":["21074"]},"periodo_ref":{"desde":"2025-07","hasta":"2026-06"},"desempeno":{"ocupacion_12m":43.6,"cuartos_libres_dia_12m":104.7,"llegadas_12m":45087,"crecimiento_llegadas_pct":-1.5,"estadia_promedio_dias":1.82,"derrama_por_visitante_mxn":1148.0,"mediana_pm_ocupacion_12m":44.1},"serie_mensual":[{"periodo":"2023-07","llegadas_turistas":4406.0,"ocupacion_pct":50.9},{"periodo":"2023-08","llegadas_turistas":4354.0,"ocupacion_pct":52.1},{"periodo":"2023-09","llegadas_turistas":4114.0,"ocupacion_pct":48.9},{"periodo":"2023-10","llegadas_turistas":3462.0,"ocupacion_pct":43.7},{"periodo":"2023-11","llegadas_turistas":3584.0,"ocupacion_pct":47.1},{"periodo":"2023-12","llegadas_turistas":3674.0,"ocupacion_pct":41.8},{"periodo":"2024-01","llegadas_turistas":2818.0,"ocupacion_pct":37.3},{"periodo":"2024-02","llegadas_turistas":3081.0,"ocupacion_pct":43.6},{"periodo":"2024-03","llegadas_turistas":5556.0,"ocupacion_pct":60.9},{"periodo":"2024-04","llegadas_turistas":3430.0,"ocupacion_pct":43.1},{"periodo":"2024-05","llegadas_turistas":3450.0,"ocupacion_pct":41.5},{"periodo":"2024-06","llegadas_turistas":3377.0,"ocupacion_pct":39.9},{"periodo":"2024-07","llegadas_turistas":3519.0,"ocupacion_pct":41.2},{"periodo":"2024-08","llegadas_turistas":3543.0,"ocupacion_pct":40.8},{"periodo":"2024-09","llegadas_turistas":4231.0,"ocupacion_pct":50.6},{"periodo":"2024-10","llegadas_turistas":4356.0,"ocupacion_pct":51.0},{"periodo":"2024-11","llegadas_turistas":3696.0,"ocupacion_pct":42.8},{"periodo":"2024-12","llegadas_turistas":3440.0,"ocupacion_pct":42.1},{"periodo":"2025-01","llegadas_turistas":3489.0,"ocupacion_pct":41.5},{"periodo":"2025-02","llegadas_turistas":3486.0,"ocupacion_pct":47.3},{"periodo":"2025-03","llegadas_turistas":3980.0,"ocupacion_pct":46.6},{"periodo":"2025-04","llegadas_turistas":4248.0,"ocupacion_pct":56.6},{"periodo":"2025-05","llegadas_turistas":3816.0,"ocupacion_pct":56.2},{"periodo":"2025-06","llegadas_turistas":3952.0,"ocupacion_pct":52.4},{"periodo":"2025-07","llegadas_turistas":3714.0,"ocupacion_pct":50.7},{"periodo":"2025-08","llegadas_turistas":3972.0,"ocupacion_pct":48.5},{"periodo":"2025-09","llegadas_turistas":3618.0,"ocupacion_pct":41.0},{"periodo":"2025-10","llegadas_turistas":3769.0,"ocupacion_pct":41.8},{"periodo":"2025-11","llegadas_turistas":4029.0,"ocupacion_pct":46.4},{"periodo":"2025-12","llegadas_turistas":4463.0,"ocupacion_pct":49.5},{"periodo":"2026-01","llegadas_turistas":3415.0,"ocupacion_pct":37.9},{"periodo":"2026-02","llegadas_turistas":3063.0,"ocupacion_pct":38.9},{"periodo":"2026-03","llegadas_turistas":3506.0,"ocupacion_pct":40.5},{"periodo":"2026-04","llegadas_turistas":3353.0,"ocupacion_pct":38.4},{"periodo":"2026-05","llegadas_turistas":3534.0,"ocupacion_pct":39.4},{"periodo":"2026-06","llegadas_turistas":4651.0,"ocupacion_pct":49.7}],"radar":{"indice_atencion":37.9,"indice_desempeno":36.4,"brecha":1.5,"cuadrante":"por_posicionar","recomendacion":"Prioridad de promoción si la experiencia reportada es buena","sensible":true,"componentes":{"busqueda":{"valor":10.58,"pctl":36.4,"n":12},"video":{"valor":0.67,"pctl":22.7,"n":149},"asistentes":{"valor":29.55,"pctl":54.5,"n":440}}},"asistentes":{"por_idioma":[{"idioma":"es","n":180,"k":35,"pct":19.4,"ic95_bajo":14.3,"ic95_alto":25.8},{"idioma":"en","n":80,"k":26,"pct":32.5,"ic95_bajo":23.2,"ic95_alto":43.4},{"idioma":"fr","n":60,"k":29,"pct":48.3,"ic95_bajo":36.2,"ic95_alto":60.7},{"idioma":"ko","n":60,"k":14,"pct":23.3,"ic95_bajo":14.4,"ic95_alto":35.4},{"idioma":"zh","n":60,"k":26,"pct":43.3,"ic95_bajo":31.6,"ic95_alto":55.9}],"dominios":[{"dominio":"sectur.gob.mx","tipo_dominio":"gobierno","n_citas":47},{"dominio":"visitpuebla.mx","tipo_dominio":"gobierno","n_citas":41},{"dominio":"en.wikipedia.org","tipo_dominio":"enciclopedia","n_citas":32},{"dominio":"opentravelguide.com","tipo_dominio":"blog","n_citas":31},{"dominio":"gob.mx","tipo_dominio":"gobierno","n_citas":30}]},"redes":null,"opinion":null,"escenario":null,"fuentes":["sectur-ot-2026-06","inegi-mg-2025-12","asistentes-auditoria","google-trends"],"notas":["Sin dato de panel"]}
