{"generado":"2026-10-16T19:54:50Z","destino":{"destino_id":"puebla","nombre":"Ciudad de Puebla","tipo":"ciudad","zona":"Centro","municipios":["21114"]},"periodo_ref":{"desde":"2025-07","hasta":"2026-06"},"desempeno":{"ocupacion_12m":60.1,"cuartos_libres_dia_12m":4263.9,"llegadas_12m":3273415,"crecimiento_llegadas_pct":2.6,"estadia_promedio_dias":1.84,"derrama_por_visitante_mxn":1290.0,"mediana_pm_ocupacion_12m":44.1},"serie_mensual":[{"periodo":"2023-07","llegadas_turistas":270921.0,"ocupacion_pct":61.8},{"periodo":"2023-08","llegadas_turistas":279524.0,"ocupacion_pct":63.1},{"periodo":"2023-09","llegadas_turistas":244563.0,"ocupacion_pct":58.8},{"periodo":"2023-10","llegadas_turistas":265143.0,"ocupacion_pct":61.5},{"periodo":"2023-11","llegadas_turistas":278883.0,"ocupacion_pct":65.2},{"periodo":"2023-12","llegadas_turistas":296035.0,"ocupacion_pct":61.8},{"periodo":"2024-01","llegadas_turistas":220535.0,"ocupacion_pct":49.1},{"periodo":"2024-02","llegadas_turistas":225317.0,"ocupacion_pct":55.3},{"periodo":"2024-03","llegadas_turistas":278311.0,"ocupacion_pct":60.2},{"periodo":"2024-04","llegadas_turistas":244393.0,"ocupacion_pct":57.5},{"periodo":"2024-05","llegadas_turistas":277150.0,"ocupacion_pct":60.3},{"periodo":"2024-06","llegadas_turistas":236827.0,"ocupacion_pct":56.3},{"periodo":"2024-07","llegadas_turistas":278178.0,"ocupacion_pct":62.1},{"periodo":"2024-08","llegadas_turistas":289745.0,"ocupacion_pct":60.7},{"periodo":"2024-09","llegadas_turistas":253220.0,"ocupacion_pct":59.8},{"periodo":"2024-10","llegadas_turistas":267901.0,"ocupacion_pct":61.5},{"periodo":"2024-11","llegadas_turistas":267973.0,"ocupacion_pct":64.6},{"periodo":"2024-12","llegadas_turistas":302173.0,"ocupacion_pct":62.0},{"periodo":"2025-01","llegadas_turistas":228996.0,"ocupacion_pct":49.9},{"periodo":"2025-02","llegadas_turistas":216307.0,"ocupacion_pct":54.8},{"periodo":"2025-03","llegadas_turistas":291910.0,"ocupacion_pct":58.4},{"periodo":"2025-04","llegadas_turistas":255373.0,"ocupacion_pct":60.5},{"periodo":"2025-05","llegadas_turistas":285130.0,"ocupacion_pct":60.6},{"periodo":"2025-06","llegadas_turistas":254602.0,"ocupacion_pct":62.4},{"periodo":"2025-07","llegadas_turistas":269902.0,"ocupacion_pct":63.9},{"periodo":"2025-08","llegadas_turistas":290241.0,"ocupacion_pct":62.3},{"periodo":"2025-09","llegadas_turistas":257916.0,"ocupacion_pct":60.2},{"periodo":"2025-10","llegadas_turistas":274868.0,"ocupacion_pct":60.0},{"periodo":"2025-11","llegadas_turistas":274535.0,"ocupacion_pct":66.4},{"periodo":"2025-12","llegadas_turistas":291737.0,"ocupacion_pct":60.1},{"periodo":"2026-01","llegadas_turistas":231740.0,"ocupacion_pct":49.9},{"periodo":"2026-02","llegadas_turistas":228417.0,"ocupacion_pct":54.2},{"periodo":"2026-03","llegadas_turistas":292422.0,"ocupacion_pct":58.5},{"periodo":"2026-04","llegadas_turistas":268055.0,"ocupacion_pct":61.3},{"periodo":"2026-05","llegadas_turistas":285441.0,"ocupacion_pct":64.4},{"periodo":"2026-06","llegadas_turistas":308141.0,"ocupacion_pct":60.2}],"radar":{"indice_atencion":null,"indice_desempeno":null,"brecha":null,"cuadrante":null,"recomendacion":null,"sensible":false,"componentes":{}},"asistentes":{"por_idioma":[{"idioma":"es","n":180,"k":125,"pct":69.4,"ic95_bajo":62.4,"ic95_alto":75.7},{"idioma":"en","n":80,"k":63,"pct":78.8,"ic95_bajo":68.6,"ic95_alto":86.3},{"idioma":"fr","n":60,"k":32,"pct":53.3,"ic95_bajo":40.9,"ic95_alto":65.4},{"idioma":"ko","n":60,"k":56,"pct":93.3,"ic95_bajo":84.1,"ic95_alto":97.4},{"idioma":"zh","n":60,"k":59,"pct":98.3,"ic95_bajo":91.1,"ic95_alto":99.7}],"dominios":[{"dominio":"visitpuebla.mx","tipo_dominio":"gobierno","n_citas":88},{"dominio":"whc.unesco.org","tipo_dominio":"enciclopedia","n_citas":65},{"dominio":"en.wikipedia.org","tipo_dominio":"enciclopedia","n_citas":63},{"dominio":"sectur.gob.mx","tipo_dominio":"gobierno","n_citas":63},{"dominio":"eluniversalpuebla.com.mx","tipo_dominio":"medio","n_citas":59}]},"redes":null,"opinion":null,"escenario":null,"fuentes":["sectur-ot-2026-06","inegi-mg-2025-12","asistentes-auditoria"],"notas":["Referencia: no entra en los percentiles"]}
