{"generado":"2026-10-17T17:13:24Z","destino":{"destino_id":"teziutlan","nombre":"Teziutlán","tipo":"pueblo_magico","zona":"Sierra Nororiental","municipios":["21174"]},"periodo_ref":{"desde":"2025-07","hasta":"2026-06"},"desempeno":{"ocupacion_12m":44.5,"cuartos_libres_dia_12m":262.3,"llegadas_12m":136443,"crecimiento_llegadas_pct":21.6,"estadia_promedio_dias":1.83,"derrama_por_visitante_mxn":855.0,"mediana_pm_ocupacion_12m":44.1},"serie_mensual":[{"periodo":"2023-07","llegadas_turistas":14546.0,"ocupacion_pct":55.5},{"periodo":"2023-08","llegadas_turistas":14623.0,"ocupacion_pct":56.5},{"periodo":"2023-09","llegadas_turistas":6500.0,"ocupacion_pct":31.8},{"periodo":"2023-10","llegadas_turistas":14278.0,"ocupacion_pct":55.6},{"periodo":"2023-11","llegadas_turistas":13452.0,"ocupacion_pct":54.4},{"periodo":"2023-12","llegadas_turistas":13671.0,"ocupacion_pct":52.7},{"periodo":"2024-01","llegadas_turistas":8663.0,"ocupacion_pct":33.0},{"periodo":"2024-02","llegadas_turistas":4880.0,"ocupacion_pct":20.2},{"periodo":"2024-03","llegadas_turistas":11298.0,"ocupacion_pct":43.1},{"periodo":"2024-04","llegadas_turistas":8383.0,"ocupacion_pct":33.0},{"periodo":"2024-05","llegadas_turistas":8405.0,"ocupacion_pct":32.5},{"periodo":"2024-06","llegadas_turistas":8625.0,"ocupacion_pct":33.9},{"periodo":"2024-07","llegadas_turistas":9257.0,"ocupacion_pct":35.4},{"periodo":"2024-08","llegadas_turistas":9457.0,"ocupacion_pct":36.3},{"periodo":"2024-09","llegadas_turistas":8714.0,"ocupacion_pct":34.5},{"periodo":"2024-10","llegadas_turistas":8895.0,"ocupacion_pct":33.8},{"periodo":"2024-11","llegadas_turistas":8857.0,"ocupacion_pct":35.1},{"periodo":"2024-12","llegadas_turistas":13427.0,"ocupacion_pct":54.5},{"periodo":"2025-01","llegadas_turistas":8744.0,"ocupacion_pct":33.5},{"periodo":"2025-02","llegadas_turistas":7991.0,"ocupacion_pct":33.9},{"periodo":"2025-03","llegadas_turistas":8848.0,"ocupacion_pct":33.9},{"periodo":"2025-04","llegadas_turistas":10205.0,"ocupacion_pct":40.3},{"periodo":"2025-05","llegadas_turistas":9137.0,"ocupacion_pct":35.2},{"periodo":"2025-06","llegadas_turistas":8717.0,"ocupacion_pct":34.8},{"periodo":"2025-07","llegadas_turistas":9270.0,"ocupacion_pct":35.5},{"periodo":"2025-08","llegadas_turistas":9529.0,"ocupacion_pct":36.5},{"periodo":"2025-09","llegadas_turistas":10637.0,"ocupacion_pct":42.5},{"periodo":"2025-10","llegadas_turistas":13570.0,"ocupacion_pct":52.4},{"periodo":"2025-11","llegadas_turistas":13332.0,"ocupacion_pct":53.1},{"periodo":"2025-12","llegadas_turistas":12262.0,"ocupacion_pct":47.4},{"periodo":"2026-01","llegadas_turistas":10484.0,"ocupacion_pct":40.1},{"periodo":"2026-02","llegadas_turistas":7993.0,"ocupacion_pct":33.9},{"periodo":"2026-03","llegadas_turistas":12745.0,"ocupacion_pct":49.0},{"periodo":"2026-04","llegadas_turistas":13042.0,"ocupacion_pct":51.7},{"periodo":"2026-05","llegadas_turistas":11472.0,"ocupacion_pct":44.2},{"periodo":"2026-06","llegadas_turistas":12107.0,"ocupacion_pct":47.9}],"radar":{"indice_atencion":31.8,"indice_desempeno":72.7,"brecha":-40.9,"cuadrante":"demanda_poco_visible","recomendacion":"Crecer con contenido; la demanda existe","sensible":false,"componentes":{"busqueda":{"valor":12.84,"pctl":45.5,"n":12},"video":{"valor":1.34,"pctl":50.0,"n":149},"asistentes":{"valor":7.5,"pctl":0.0,"n":440}}},"asistentes":{"por_idioma":[{"idioma":"es","n":180,"k":15,"pct":8.3,"ic95_bajo":5.1,"ic95_alto":13.3},{"idioma":"en","n":80,"k":5,"pct":6.2,"ic95_bajo":2.7,"ic95_alto":13.8},{"idioma":"fr","n":60,"k":8,"pct":13.3,"ic95_bajo":6.9,"ic95_alto":24.2},{"idioma":"ko","n":60,"k":1,"pct":1.7,"ic95_bajo":0.3,"ic95_alto":8.9},{"idioma":"zh","n":60,"k":4,"pct":6.7,"ic95_bajo":2.6,"ic95_alto":15.9}],"dominios":[{"dominio":"sectur.gob.mx","tipo_dominio":"gobierno","n_citas":22},{"dominio":"visitpuebla.mx","tipo_dominio":"gobierno","n_citas":22},{"dominio":"gob.mx","tipo_dominio":"gobierno","n_citas":12},{"dominio":"pueblaexpuesta.com","tipo_dominio":"otro","n_citas":12},{"dominio":"eluniversalpuebla.com.mx","tipo_dominio":"medio","n_citas":9}]},"redes":null,"opinion":null,"escenario":null,"fuentes":["sectur-ot-2026-06","inegi-mg-2025-12","asistentes-auditoria","google-trends"],"notas":["Sin dato de panel"]}
